{"from":"2025-11","to":"2026-10","national":{"from":"2000-01","columns":["month","sales","median_psm","median_price"],"rows":[["2000-01",2386,2619.05,252000],["2000-02",2313,2634.62,253000],["2000-03",2467,2631.58,253000],["2000-04",2548,2600.75,250000],["2000-05",3230,2591.82,245000],["2000-06",3283,2549.18,240000],["2000-07",2988,2529.41,234000],["2000-08",3166,2512.15,235000],["2000-09",3088,2504.28,235000],["2000-10",3231,2500,234000],["2000-11",3324,2465.44,230000],["2000-12",2838,2451.92,226000],["2001-01",2790,2423.08,230000],["2001-02",2885,2400,228000],["2001-03",3147,2406.59,229000],["2001-04",3092,2380.95,226250],["2001-05",3106,2383.94,228000],["2001-06",3329,2350.59,223080],["2001-07",3398,2336.8,225000],["2001-08",3244,2346.34,229000],["2001-09",3220,2337.15,226000],["2001-10",3490,2319.41,221500],["2001-11",3349,2297.52,216000],["2001-12",3005,2291.67,216000],["2002-01",3385,2266.13,215000],["2002-02",2633,2272.73,215000],["2002-03",3115,2268.29,215000],["2002-04",3300,2282.61,218000],["2002-05",3298,2302.46,222000],["2002-06",2836,2300,220000],["2002-07",3282,2255.88,215000],["2002-08",2829,2253.01,208000],["2002-09",2749,2307.69,220000],["2002-10",3156,2285.71,214000],["2002-11",2831,2285.71,213000],["2002-12",2684,2262.43,210150],["2003-01",2705,2247.52,209000],["2003-02",1858,2280.66,210000],["2003-03",2270,2313.43,215750],["2003-04",2160,2333.33,213000],["2003-05",2272,2344.5,213000],["2003-06",2162,2367.4,213000],["2003-07",2273,2393.26,220000],["2003-08",2195,2391.3,217000],["2003-09",2423,2397.26,220000],["2003-10",2849,2432.84,220000],["2003-11",2801,2432.84,220000],["2003-12",3035,2442.62,220000],["2004-01",2659,2440.48,220000],["2004-02",2757,2442.62,220000],["2004-03",2775,2462.69,225000],["2004-04",2195,2506.67,225000],["2004-05",2143,2500,225000],["2004-06",2206,2492.19,228000],["2004-07",2321,2500,222000],["2004-08",2238,2473.05,220000],["2004-09",2382,2482.56,220000],["2004-10",2441,2475.25,226000],["2004-11",2426,2500,226750],["2004-12",2569,2492.54,221000],["2005-01",2754,2500,223000],["2005-02",2316,2500,230000],["2005-03",2977,2500,225000],["2005-04",2491,2461.54,228000],["2005-05",2320,2439.83,225000],["2005-06",2564,2412.65,224000],["2005-07",2375,2388.89,221000],["2005-08",2559,2388.06,222000],["2005-09",2512,2387.55,222750],["2005-10",2506,2388.25,228000],["2005-11",2408,2395.72,227000],["2005-12",2263,2388.89,230000],["2006-01",2039,2395.6,225588],["2006-02",2183,2380,227000],["2006-03",2463,2398.06,227000],["2006-04",2093,2403.1,231000],["2006-05",2406,2417.91,228000],["2006-06",2546,2404.94,227000],["2006-07",2400,2411.23,226650],["2006-08",2452,2411.18,228650],["2006-09",2418,2435.04,228000],["2006-10",2190,2423.77,227000],["2006-11",2284,2433.41,226650],["2006-12",1953,2440.3,228000],["2007-01",2289,2461.82,236000],["2007-02",1933,2460,235000],["2007-03",2364,2478.36,239000],["2007-04",2066,2485.22,235000],["2007-05",2164,2500,240000],["2007-06",2224,2518.77,248000],["2007-07",2364,2552.82,252000],["2007-08",2523,2581.82,257000],["2007-09",2361,2675.86,260100],["2007-10",2442,2721.94,266000],["2007-11",2322,2785.46,265000],["2007-12",1930,2859.48,270000],["2008-01",2285,2916.67,285000],["2008-02",2028,2964.13,277750],["2008-03",2145,2983.87,288888],["2008-04",2341,3070.18,292000],["2008-05",2178,3116.52,298000],["2008-06",2270,3161.24,303000],["2008-07",2458,3207.38,313000],["2008-08",2197,3254.55,310000],["2008-09",2492,3298.74,320000],["2008-10",2395,3322.31,320000],["2008-11",2424,3331.88,325000],["2008-12",2049,3333.33,322000],["2009-01",2006,3327.27,315000],["2009-02",1817,3324.32,310000],["2009-03",2480,3279.35,310000],["2009-04",2299,3343.28,315000],["2009-05",2222,3356.08,318000],["2009-06",2440,3365.12,320000],["2009-07",2672,3406.79,328000],["2009-08",2550,3432.84,335000],["2009-09",2916,3446.76,333000],["2009-10",3432,3465.52,347000],["2009-11",2853,3510.64,345000],["2009-12",2795,3582.09,350000],["2010-01",2825,3589.74,347000],["2010-02",2418,3623.68,348000],["2010-03",3264,3649.63,350000],["2010-04",3036,3704.48,351500],["2010-05",2812,3780.87,360000],["2010-06",3517,3835.62,363000],["2010-07",3679,3902.44,370500],["2010-08",3298,3967.57,374500],["2010-09",3002,4029.85,385000],["2010-10",2773,4063.83,386000],["2010-11",2208,4084.11,382444],["2010-12",2022,4142.23,385000],["2011-01",2131,4154.55,388000],["2011-02",1747,4178.08,397000],["2011-03",1991,4178.22,395000],["2011-04",1980,4230.77,398000],["2011-05",1958,4289.53,403000],["2011-06",2026,4348.92,408944],["2011-07",1996,4418.05,415000],["2011-08",1730,4461.16,419500],["2011-09",1790,4535.18,420000],["2011-10",1615,4565.22,432000],["2011-11",1745,4514.93,425000],["2011-12",1572,4567.31,433250],["2012-01",1559,4594.59,432888],["2012-02",1629,4571.43,430000],["2012-03",2360,4624.76,435000],["2012-04",2155,4639.64,436000],["2012-05",2323,4684.68,440000],["2012-06",1993,4668.97,443000],["2012-07",2179,4689.66,442800],["2012-08",2075,4760,450000],["2012-09",1760,4782.18,455000],["2012-10",1937,4836.36,457000],["2012-11",1735,4820.9,456000],["2012-12",1493,4818.88,458000],["2013-01",1633,4857.14,460000],["2013-02",886,4953.9,452000],["2013-03",1306,4946.21,455000],["2013-04",1692,4923.08,470000],["2013-05",1605,4958.9,463000],["2013-06",1317,4940.3,458000],["2013-07",1484,4866.97,460000],["2013-08",1354,4923.08,458889],["2013-09",1212,4879.03,450000],["2013-10",1391,4835.62,448000],["2013-11",1209,4794.52,442000],["2013-12",1008,4810.66,440000],["2014-01",1098,4764.51,435000],["2014-02",959,4684.93,425000],["2014-03",1444,4720.41,430000],["2014-04",1557,4687.5,425000],["2014-05",1447,4647.06,420000],["2014-06",1223,4590.55,420000],["2014-07",1352,4552.91,414400],["2014-08",1329,4478.26,420000],["2014-09",1472,4462.37,410000],["2014-10",1560,4438.4,417000],["2014-11",1351,4402.99,408000],["2014-12",1304,4384.91,410000],["2015-01",1250,4359.72,415000],["2015-02",1151,4328.36,405000],["2015-03",1348,4342.21,403000],["2015-04",1630,4338.24,406000],["2015-05",1567,4297.3,410000],["2015-06",1706,4373.01,405000],["2015-07",1551,4264.71,405000],["2015-08",1449,4298.76,403000],["2015-09",1498,4259.86,405500],["2015-10",1748,4280.24,400000],["2015-11",1470,4285.71,408000],["2015-12",1412,4291.61,410000],["2016-01",1280,4272.73,400000],["2016-02",1200,4291,405500],["2016-03",1655,4307.69,410000],["2016-04",1824,4275.88,410000],["2016-05",1829,4272.73,414000],["2016-06",1827,4281.91,408000],["2016-07",1572,4363.64,416750],["2016-08",1882,4307.69,403000],["2016-09",1668,4296.02,410000],["2016-10",1678,4307.69,408500],["2016-11",1580,4280.91,410000],["2016-12",1378,4314.38,410000],["2017-01",1185,4294.48,405000],["2017-02",1085,4321.68,415000],["2017-03",1903,4330.99,415000],["2017-04",1839,4298.51,408000],["2017-05",1980,4270.48,410000],["2017-06",1747,4293.48,415000],["2017-07",1780,4243.16,405000],["2017-08",1960,4280.2,415000],["2017-09",1680,4277.78,418000],["2017-10",1785,4269.23,410000],["2017-11",1980,4253.73,410000],["2017-12",1585,4252.43,418000],["2018-01",1072,4285.71,415000],["2018-02",1183,4244.68,408000],["2018-03",1881,4239.13,418000],["2018-04",1838,4235.17,410000],["2018-05",1740,4230.77,412000],["2018-06",1975,4207.92,410000],["2018-07",2539,4211.38,415000],["2018-08",2067,4232.88,405000],["2018-09",1985,4179.1,400000],["2018-10",1992,4146.09,398500],["2018-11",1866,4165.43,395500],["2018-12",1423,4177.78,395000],["2019-01",1550,4135.34,395000],["2019-02",1304,4175.82,393000],["2019-03",1653,4193.55,400000],["2019-04",1915,4153.85,400000],["2019-05",2070,4166.67,400000],["2019-06",1884,4130.43,400000],["2019-07",2114,4165.3,405000],["2019-08",1902,4205.02,405000],["2019-09",1830,4152.36,400000],["2019-10",2206,4194.99,400444],["2019-11",1910,4212.19,405000],["2019-12",1848,4193.55,405000],["2020-01",1911,4201.38,400000],["2020-02",1661,4239.13,408000],["2020-03",1937,4253.73,412000],["2020-04",424,4233.15,424000],["2020-05",363,4242.42,430000],["2020-06",2438,4202.8,405000],["2020-07",2456,4286.93,413000],["2020-08",2426,4297.52,425000],["2020-09",2482,4384.09,431000],["2020-10",2427,4516.13,450000],["2020-11",2322,4538.46,446888],["2020-12",2486,4576.6,450500],["2021-01",2491,4623.66,460000],["2021-02",2160,4728.26,460000],["2021-03",2443,4765.96,465000],["2021-04",2333,4807.69,472000],["2021-05",1957,4870.97,480000],["2021-06",2302,4879.79,482000],["2021-07",2659,4895.52,480000],["2021-08",2739,5000,490000],["2021-09",2516,5000,492000],["2021-10",2499,5032.26,500000],["2021-11",2566,5088.69,503000],["2021-12",2422,5147.06,505000],["2022-01",2442,5133.94,500000],["2022-02",1895,5149.25,508000],["2022-03",2262,5223.88,510000],["2022-04",2262,5265.17,520000],["2022-05",2154,5340.38,520000],["2022-06",2135,5357.14,530000],["2022-07",2361,5446.43,530000],["2022-08",2309,5368.85,522000],["2022-09",2578,5510.51,538000],["2022-10",1958,5555.56,542750],["2022-11",2130,5512.23,538000],["2022-12",2234,5588.07,530000],["2023-01",2551,5591.4,535000],["2023-02",1837,5565.22,535800],["2023-03",2277,5653.85,543800],["2023-04",2177,5707.96,550000],["2023-05",2245,5671.64,550000],["2023-06",1853,5699.3,550000],["2023-07",2052,5706.92,555000],["2023-08",2467,5772.73,555000],["2023-09",1974,5743.05,550000],["2023-10",2189,5806.45,555000],["2023-11",2128,5806.45,560000],["2023-12",2004,5818.06,560000],["2024-01",2621,5875,570000],["2024-02",2123,5847.83,568000],["2024-03",2046,5913.98,572000],["2024-04",2370,5944.44,570000],["2024-05",2490,5978.26,580000],["2024-06",2171,6115.11,595000],["2024-07",3036,6142.08,595000],["2024-08",2591,6129.03,600000],["2024-09",2204,6268,610000],["2024-10",2139,6294.74,615000],["2024-11",1929,6275.51,615000],["2024-12",2112,6364.36,615444],["2025-01",2313,6369.86,612888],["2025-02",2091,6451.61,620000],["2025-03",1899,6478.49,625000],["2025-04",2297,6576.27,630000],["2025-05",2266,6563.61,635000],["2025-06",2260,6492.54,632400],["2025-07",2562,6526.8,628000],["2025-08",2202,6506.66,622000],["2025-09",2174,6537.63,645000],["2025-10",1338,6533.33,620000],["2025-11",1658,6492.54,618000],["